{
  "schemaVersion": 1,
  "comparison": {
    "base": "abc1111",
    "head": "def2222",
    "repository": "example/widgets"
  },
  "behavioralGroups": [
    {
      "id": "bg-1",
      "title": "Rate-limit login attempts",
      "description": "Adds a sliding-window limiter around the login handler.",
      "order": 0,
      "risk": "high",
      "targets": [
        { "type": "file", "path": "src/auth/login.ts" }
      ]
    }
  ],
  "annotations": [
    {
      "id": "an-1",
      "target": {
        "type": "line",
        "path": "src/auth/login.ts",
        "side": "head",
        "line": 42,
        "expectedText": "if (attempts > MAX_ATTEMPTS) {"
      },
      "summary": "Rejects further attempts once the sliding window limit is hit.",
      "kind": "behavior",
      "evidenceIds": ["ev-1"]
    }
  ],
  "evidence": [
    {
      "id": "ev-1",
      "kind": "observed",
      "description": "MAX_ATTEMPTS is read from config, defaulting to 5.",
      "targetIds": ["an-1"]
    }
  ],
  "verification": [
    {
      "id": "vi-1",
      "description": "Confirm the limiter resets after the window elapses.",
      "status": "unverified",
      "targetIds": ["bg-1"]
    }
  ],
  "answers": [
    {
      "id": "ans-1",
      "questionId": "q-1",
      "body": "The window is 60 seconds, configured via RATE_LIMIT_WINDOW_MS.",
      "evidenceIds": ["ev-1"]
    }
  ]
}
